{
  "spec_version": "0.2.0",
  "event_id": "evt_canonical_001",
  "ts": "2026-02-08T20:40:00Z",

  "principal": {
    "principal_id": "example_agent"
  },

  "action": "example.transition",

  "subject": {
    "subject_id": "example:object-001",
    "subject_type": "example_object"
  },

  "context": {
    "note": "Canonical example of the unified RouteGuard interaction_event envelope."
  }
}
